{
  "$schema": "https://json-schema.org/draft/2020-12/schema",
  "$id": "https://mythicalvoid.com/company/schemas/protected-cryptographic-misuse-and-recovery-poisoning.schema.json",
  "title": "Mythical protected cryptographic-misuse and recovery-poisoning rehearsal",
  "type": "object",
  "required": ["schemaVersion", "asOf", "status", "purpose", "decisionRefs", "riskRefs", "workflowRefs", "authority", "sourceEvidence", "misusePolicy", "scenarioPlan", "refusalPlan", "rehearsalStore", "productionSecurityPolicy", "activationGates", "scenarioCount", "probeEncryptionCount", "recoveryApproverCount", "refusalScenarioCount", "expectedRefusalCount", "configuredProductionSecurityControlCount", "configuredProductionIdentityCount", "satisfiedActivationGateCount", "cryptographicMisuseContractReadyForReview", "productionCryptographicSafetyReady", "productionRecoveryPoisoningDefenseReady", "eligibleCycleReady", "externalActionAuthorized", "nextDecision"],
  "properties": {
    "schemaVersion": { "const": 1 },
    "asOf": { "type": "string", "format": "date" },
    "status": { "const": "offline_cryptographic_misuse_recovery_poisoning_and_objective_gaming_rehearsal_ready_production_security_gated" },
    "purpose": { "type": "string", "minLength": 1300 },
    "decisionRefs": { "type": "array", "uniqueItems": true },
    "riskRefs": { "type": "array", "uniqueItems": true },
    "workflowRefs": { "type": "array", "uniqueItems": true },
    "authority": { "type": "object", "additionalProperties": { "const": false } },
    "sourceEvidence": { "type": "object" },
    "misusePolicy": { "type": "object" },
    "scenarioPlan": { "type": "object" },
    "refusalPlan": { "type": "object" },
    "rehearsalStore": { "type": "object" },
    "productionSecurityPolicy": { "type": "object" },
    "activationGates": { "type": "array", "minItems": 18, "maxItems": 18 },
    "scenarioCount": { "const": 20 },
    "probeEncryptionCount": { "const": 32 },
    "recoveryApproverCount": { "const": 3 },
    "refusalScenarioCount": { "const": 25 },
    "expectedRefusalCount": { "const": 25 },
    "configuredProductionSecurityControlCount": { "const": 0 },
    "configuredProductionIdentityCount": { "const": 0 },
    "satisfiedActivationGateCount": { "const": 0 },
    "cryptographicMisuseContractReadyForReview": { "const": true },
    "productionCryptographicSafetyReady": { "const": false },
    "productionRecoveryPoisoningDefenseReady": { "const": false },
    "eligibleCycleReady": { "const": false },
    "externalActionAuthorized": { "const": false },
    "nextDecision": { "type": "string", "minLength": 1500 }
  },
  "additionalProperties": false
}
