{
  "schemaVersion": 1,
  "asOf": "2026-08-11",
  "status": "offline_cryptographic_misuse_recovery_poisoning_and_objective_gaming_rehearsal_ready_production_security_gated",
  "purpose": "Define and adversarially rehearse the cryptographic-misuse, compromised-approver, recovery-poisoning, recovery-objective-gaming, and bounded-denial-of-service boundary required before Mythical may rely on A-052 encrypted recovery evidence. The control consumes the current A-052 output and contract digests, builds a new payload-free authenticated recovery capsule with exact additional authenticated data, performs thirty-two real AES-256-GCM probe encryptions using thirty-two deterministically unique nonces, refuses a real exclusive-create nonce replay before encryption, and attacks algorithm, nonce, AAD, ciphertext, tag, key-version, generation, time, objective-origin, approval, payload, authority, size, attempt-budget, and global-disable boundaries. Three ephemeral Ed25519 recovery identities include two trusted and one explicitly compromised signer; approval verification deduplicates identities, binds signatures to the exact recovery request, and refuses compromised or unknown identities. Independent incident, detection, and completion timestamps prevent an attacker from shrinking RPO or RTO by moving the measurement origin. Thirty-two exclusive attempt markers enforce a local request ceiling and the thirty-third attempt fails before decryption. All keys, markers, envelopes, approvals, and evidence are removed; no production provider, account, identity, approver, secret manager, key-management service, objective, store, network, restore, admission, schedule, dispatch, spend, or external action is configured or authorized.",
  "decisionRefs": ["D-014", "D-017"],
  "riskRefs": ["R-011", "R-013"],
  "workflowRefs": ["A-012", "A-023", "A-030", "A-031", "A-035", "A-041", "A-042", "A-046", "A-047", "A-048", "A-049", "A-050", "A-051", "A-052", "A-053"],
  "authority": {
    "productionCryptographicPolicyAuthorized": false,
    "productionRecoveryObjectiveAuthorized": false,
    "productionKeyManagementAuthorized": false,
    "productionKeyRecoveryAuthorized": false,
    "productionBackupAuthorized": false,
    "productionRestoreAuthorized": false,
    "restoredActivationAuthorized": false,
    "productionRecordWriteAuthorized": false,
    "schedulerActivationAuthorized": false,
    "triggerActivationAuthorized": false,
    "packetAdmissionAuthorized": false,
    "packetExecutionAuthorized": false,
    "credentialUseAuthorized": false,
    "networkAccessAuthorized": false,
    "repositoryWriteAuthorized": false,
    "automatedDispatchAuthorized": false,
    "spendAuthorized": false,
    "externalActionAuthorized": false,
    "conversationIsAuthorization": false
  },
  "sourceEvidence": {
    "recoveryObjectiveWorkflowId": "A-052",
    "recoveryObjectiveContractPath": "docs/company/automation/protected-recovery-objectives-and-key-continuity.json",
    "currentRecoveryObjectiveEvidenceDigestRequired": true,
    "currentRecoveryObjectiveContractDigestRequired": true,
    "recoveryObjectiveExitCode": 2,
    "recoveryObjectiveRehearsalValidRequired": true,
    "rawEvidencePayloadPermitted": false,
    "scheduledCompanyWorkflowInvocationPermitted": false
  },
  "misusePolicy": {
    "capsuleSchemaVersion": 1,
    "digestAlgorithm": "sha256",
    "encryptionAlgorithm": "aes-256-gcm",
    "keyByteLength": 32,
    "nonceByteLength": 12,
    "authenticationTagByteLength": 16,
    "probeEncryptionCount": 32,
    "requiredUniqueNonceCount": 32,
    "maximumCiphertextBytes": 4096,
    "maximumAttemptCount": 32,
    "currentGeneration": 3,
    "currentKeyVersion": "KV-002",
    "requiredRecoveryApprovalCount": 2,
    "recoveryApproverCount": 3,
    "trustedRecoveryApproverCount": 2,
    "compromisedRecoveryApproverCount": 1,
    "maximumRecoveryPointLossSeconds": 300,
    "maximumRecoveryTimeSeconds": 300,
    "independentIncidentAt": "2026-08-11T12:02:00.000Z",
    "independentDetectionAt": "2026-08-11T12:00:00.000Z",
    "validRecoveryPointAt": "2026-08-11T11:58:00.000Z",
    "validRecoveryCompleteAt": "2026-08-11T12:04:00.000Z",
    "nonceReusePermitted": false,
    "algorithmDowngradePermitted": false,
    "aadSubstitutionPermitted": false,
    "generationRollbackPermitted": false,
    "compromisedSignerPermitted": false,
    "duplicateSignerCountsTowardThreshold": false,
    "objectiveOriginOverridePermitted": false,
    "oversizedCiphertextDecryptionPermitted": false,
    "attemptBudgetOverflowPermitted": false,
    "rawPayloadIncluded": false,
    "productionCredentialMaterialIncluded": false,
    "externalActionAuthorized": false,
    "sensitivePayloadIncluded": false,
    "aadFields": ["capsuleId", "generation", "recoveryPointAt", "keyVersion", "sourceWorkflowId", "sourceEvidenceDigestSha256", "sourceContractDigestSha256"],
    "capsuleFields": ["schemaVersion", "capsuleId", "generation", "recoveryPointAt", "keyVersion", "sourceWorkflowId", "sourceEvidenceDigestSha256", "sourceContractDigestSha256", "rawPayloadIncluded", "productionCredentialMaterialIncluded", "externalActionAuthorized", "sensitivePayloadIncluded"],
    "envelopeFields": ["schemaVersion", "capsuleId", "generation", "recoveryPointAt", "keyVersion", "algorithm", "nonceBase64", "ciphertextBase64", "authenticationTagBase64", "aadDigestSha256", "externalActionAuthorized", "sensitivePayloadIncluded"]
  },
  "scenarioPlan": {
    "scenarioCount": 20,
    "scenarios": [
      { "sequence": 1, "id": "CM-001", "attack": "thirty_two_probe_encryptions", "expectedOutcome": "thirty_two_unique_nonces_recorded" },
      { "sequence": 2, "id": "CM-002", "attack": "reuse_registered_nonce", "expectedOutcome": "nonce_reuse_refused_before_encryption" },
      { "sequence": 3, "id": "CM-003", "attack": "downgrade_encryption_algorithm", "expectedOutcome": "algorithm_downgrade_refused" },
      { "sequence": 4, "id": "CM-004", "attack": "substitute_aad_capsule_id", "expectedOutcome": "aad_capsule_substitution_refused" },
      { "sequence": 5, "id": "CM-005", "attack": "substitute_aad_generation", "expectedOutcome": "aad_generation_substitution_refused" },
      { "sequence": 6, "id": "CM-006", "attack": "substitute_aad_source_digest", "expectedOutcome": "aad_source_substitution_refused" },
      { "sequence": 7, "id": "CM-007", "attack": "flip_ciphertext_bit", "expectedOutcome": "ciphertext_bitflip_refused" },
      { "sequence": 8, "id": "CM-008", "attack": "flip_authentication_tag_bit", "expectedOutcome": "authentication_tag_bitflip_refused" },
      { "sequence": 9, "id": "CM-009", "attack": "substitute_key_version", "expectedOutcome": "wrong_key_version_refused" },
      { "sequence": 10, "id": "CM-010", "attack": "rollback_generation", "expectedOutcome": "generation_rollback_refused" },
      { "sequence": 11, "id": "CM-011", "attack": "future_recovery_point", "expectedOutcome": "future_recovery_point_refused" },
      { "sequence": 12, "id": "CM-012", "attack": "use_compromised_recovery_signer", "expectedOutcome": "compromised_signer_refused" },
      { "sequence": 13, "id": "CM-013", "attack": "duplicate_one_signer_for_threshold", "expectedOutcome": "duplicate_signer_refused" },
      { "sequence": 14, "id": "CM-014", "attack": "use_unknown_recovery_signer", "expectedOutcome": "unknown_signer_refused" },
      { "sequence": 15, "id": "CM-015", "attack": "substitute_signed_recovery_request", "expectedOutcome": "approval_request_substitution_refused" },
      { "sequence": 16, "id": "CM-016", "attack": "move_rpo_measurement_origin", "expectedOutcome": "rpo_origin_gaming_refused" },
      { "sequence": 17, "id": "CM-017", "attack": "exclude_detection_and_decision_from_rto", "expectedOutcome": "rto_origin_gaming_refused" },
      { "sequence": 18, "id": "CM-018", "attack": "oversized_ciphertext", "expectedOutcome": "oversized_envelope_refused_before_decryption" },
      { "sequence": 19, "id": "CM-019", "attack": "thirty_third_attempt", "expectedOutcome": "attempt_budget_enforced" },
      { "sequence": 20, "id": "CM-020", "attack": "global_disable_before_effect", "expectedOutcome": "disabled_effect_refused" }
    ],
    "expectedPassedScenarioCount": 20,
    "expectedProbeEncryptionCount": 32,
    "expectedUniqueNonceCount": 32,
    "expectedNonceReuseRefusalCount": 1,
    "expectedAlgorithmDowngradeRefusalCount": 1,
    "expectedAadSubstitutionRefusalCount": 3,
    "expectedAuthenticatedDecryptionRefusalCount": 2,
    "expectedKeyVersionRefusalCount": 1,
    "expectedRollbackRefusalCount": 1,
    "expectedFuturePointRefusalCount": 1,
    "expectedApprovalRefusalCount": 4,
    "expectedObjectiveGamingRefusalCount": 2,
    "expectedOversizeRefusalCount": 1,
    "expectedAttemptBudgetRefusalCount": 1,
    "expectedGlobalDisableEffectBlockCount": 1
  },
  "refusalPlan": {
    "scenarioCount": 25,
    "expectedRefusalCount": 25,
    "scenarios": [
      { "id": "CP-001", "mutation": "substitute_A-052_evidence", "expectedReasonCode": "source_evidence_mismatch" },
      { "id": "CP-002", "mutation": "substitute_A-052_contract_digest", "expectedReasonCode": "source_contract_mismatch" },
      { "id": "CP-003", "mutation": "reuse_nonce", "expectedReasonCode": "nonce_reuse_detected" },
      { "id": "CP-004", "mutation": "invalid_nonce_length", "expectedReasonCode": "nonce_invalid" },
      { "id": "CP-005", "mutation": "algorithm_downgrade", "expectedReasonCode": "algorithm_invalid" },
      { "id": "CP-006", "mutation": "substitute_aad_digest", "expectedReasonCode": "aad_binding_invalid" },
      { "id": "CP-007", "mutation": "corrupt_ciphertext", "expectedReasonCode": "authenticated_decryption_failed" },
      { "id": "CP-008", "mutation": "corrupt_authentication_tag", "expectedReasonCode": "authenticated_decryption_failed" },
      { "id": "CP-009", "mutation": "substitute_key_version", "expectedReasonCode": "key_version_invalid" },